cargo,nombre,fecha
Presidente,Presidente Dr. Juan Manuel CID,2018-12-30
Vocal por la Mayoria,Vocalía por la MayoríaVocal Dra. Graciela del Valle CHAYEP,2018-12-29
Vocal por la Minoria,Vocalía por la MinoríaVocal  Dr. Esteban BRIA,2018-12-29
Secretaria de Fiscalizacion Legal,Secretario Dr. Carlos Martin PEREYRA,2018-12-29
Prosecretaria de Fiscalizacion Legal,Prosecretario Dr. Gustavo Alfredo FERRARI,2018-12-29
Secretaria de Fiscalizacion Presupuestaria,Secretario Cr. Eduardo Serafin FLORES,2018-12-29
Prosecretaria de Fiscalizacion Presupuestaria,Prosecretario Cr. Ruben Hector RAMIREZ,2018-12-29
Fiscalia,"A la fecha 2018-12-30, el Fiscalia es Fiscal Cra. Inés Silvia ZANETTI",2018-12-29
